{
  "case_id": "data-platform",
  "roles": [
    "data-architect",
    "data-governance-lead",
    "data-engineer",
    "privacy-architect",
    "platform-engineer",
    "service-transition-and-operational-readiness-manager"
  ],
  "workflows": [
    "data-product-delivery",
    "design-to-operational-readiness"
  ],
  "requirements_covered": [
    "REQ-08-1",
    "REQ-08-2",
    "REQ-08-3",
    "REQ-08-4"
  ],
  "evidence_links": [
    "EV-08-1",
    "EV-08-2",
    "EV-08-3",
    "EV-08-4"
  ],
  "claims": [
    {
      "id": "CLAIM-1",
      "critical": true,
      "evidence": [
        "EV-08-1"
      ]
    },
    {
      "id": "CLAIM-2",
      "critical": true,
      "evidence": [
        "EV-08-2"
      ]
    },
    {
      "id": "CLAIM-3",
      "critical": true,
      "evidence": [
        "EV-08-3"
      ]
    },
    {
      "id": "CLAIM-4",
      "critical": true,
      "evidence": [
        "EV-08-4"
      ]
    }
  ],
  "decision_rationale": {
    "chosen_option": "Option A",
    "alternatives": [
      "Option A",
      "Option B"
    ],
    "trade_offs": [
      "cost vs risk",
      "speed vs control"
    ],
    "rationale": "Evidence-backed choice within stated constraints",
    "residual_risk": "Owned residual risk remains",
    "decision_owner": "Named authority"
  },
  "traceability_links": [
    "TR-08-1",
    "TR-08-2",
    "TR-08-3",
    "TR-08-4"
  ],
  "reviewer_findings": [
    "DEF-08-1",
    "DEF-08-2",
    "DEF-08-3",
    "DEF-08-4"
  ],
  "sod_violations": [],
  "publications": [
    "Data platform architecture",
    "Data governance/control design",
    "Data product contract",
    "Operational handover"
  ],
  "artifact_status": [
    {
      "name": "Data platform architecture",
      "ok": true
    },
    {
      "name": "Data governance/control design",
      "ok": true
    },
    {
      "name": "Data product contract",
      "ok": true
    },
    {
      "name": "Operational handover",
      "ok": true
    }
  ],
  "visual_qa": {
    "score": 1.0,
    "critical_defects": 0
  },
  "cross_agent": {
    "checks": 6,
    "conflicts": 0
  }
}
